[
  {
    "id": "claim-bis-rule-2025-00636-title",
    "claim_type": "FACT",
    "statement": "Rule 2025-00636 is titled 'Framework for Artificial Intelligence Diffusion'; its AGENCY line names the Bureau of Industry and Security, Department of Commerce.",
    "evidence_status": "supported",
    "citations": [
      {
        "source_id": "src-062",
        "locator": "p.1, heading (title)",
        "anchor": "Framework for Artificial Intelligence Diffusion",
        "standing": "originator",
        "read": {
          "accessed_at": "2026-10-15T07:13Z",
          "sha256": "0ec0f7fc1016b9654ea0559819e821d1baee1814efe1e0048a10d5df9230f86c"
        }
      },
      {
        "source_id": "src-062",
        "locator": "p.1, AGENCY",
        "anchor": "AGENCY: Bureau of Industry and Security, Department of Commerce.",
        "standing": "originator",
        "read": {
          "accessed_at": "2026-10-15T07:13Z",
          "sha256": "0ec0f7fc1016b9654ea0559819e821d1baee1814efe1e0048a10d5df9230f86c"
        }
      }
    ],
    "as_of": "2025-01-15",
    "verified_on": "2026-10-15",
    "review": {
      "state": "not_reviewed"
    }
  },
  {
    "id": "claim-bis-rule-2025-00636-citation",
    "claim_type": "FACT",
    "statement": "The rule begins on page 4544 of volume 90 (No. 9) of the Federal Register, the issue of Wednesday, 15 January 2025; recorded in the Atlas as 90 FR 4544.",
    "evidence_status": "supported",
    "citations": [
      {
        "source_id": "src-062",
        "locator": "p.1, page header",
        "anchor": "4544 Federal Register / Vol. 90, No. 9 / Wednesday, January 15, 2025 / Rules and Regulations",
        "standing": "originator",
        "read": {
          "accessed_at": "2026-10-15T07:13Z",
          "sha256": "0ec0f7fc1016b9654ea0559819e821d1baee1814efe1e0048a10d5df9230f86c"
        }
      }
    ],
    "as_of": "2025-01-15",
    "verified_on": "2026-10-15",
    "review": {
      "state": "not_reviewed"
    }
  },
  {
    "id": "claim-bis-rule-2025-00636-document-number",
    "claim_type": "FACT",
    "statement": "The rule's Federal Register document number is 2025-00636.",
    "evidence_status": "supported",
    "citations": [
      {
        "source_id": "src-062",
        "locator": "p.41, closing filing line",
        "anchor": "[FR Doc. 2025–00636 Filed 1–13–25; 8:45 am]",
        "standing": "originator",
        "read": {
          "accessed_at": "2026-10-15T07:13Z",
          "sha256": "0ec0f7fc1016b9654ea0559819e821d1baee1814efe1e0048a10d5df9230f86c"
        }
      }
    ],
    "as_of": "2025-01-15",
    "verified_on": "2026-10-15",
    "review": {
      "state": "not_reviewed"
    }
  },
  {
    "id": "claim-bis-rule-2025-00636-form",
    "claim_type": "FACT",
    "statement": "The Federal Register labels the rule an interim final rule, with a request for comments.",
    "evidence_status": "supported",
    "citations": [
      {
        "source_id": "src-062",
        "locator": "p.1, ACTION",
        "anchor": "ACTION: Interim final rule; request for comments.",
        "standing": "originator",
        "read": {
          "accessed_at": "2026-10-15T07:13Z",
          "sha256": "0ec0f7fc1016b9654ea0559819e821d1baee1814efe1e0048a10d5df9230f86c"
        }
      }
    ],
    "as_of": "2025-01-15",
    "verified_on": "2026-10-15",
    "review": {
      "state": "not_reviewed"
    }
  },
  {
    "id": "claim-bis-rule-2025-00636-amends-ear",
    "claim_type": "FACT",
    "statement": "The rule amends parts 732, 734, 740, 742, 744, 748, 750, 762, 772 and 774 of the Export Administration Regulations (15 CFR parts 730 through 774).",
    "evidence_status": "supported",
    "citations": [
      {
        "source_id": "src-062",
        "locator": "p.14, the amendatory clause",
        "anchor": "Accordingly, parts 732, 734, 740, 742, 744, 748, 750, 762, 772, and 774 of the Export Administration Regulations (15 CFR parts 730 through 774) are amended as follows:",
        "standing": "originator",
        "read": {
          "accessed_at": "2026-10-15T07:13Z",
          "sha256": "0ec0f7fc1016b9654ea0559819e821d1baee1814efe1e0048a10d5df9230f86c"
        }
      }
    ],
    "as_of": "2025-01-15",
    "verified_on": "2026-10-15",
    "review": {
      "state": "not_reviewed"
    }
  },
  {
    "id": "claim-bis-rule-2025-00636-export-controls",
    "claim_type": "ATTRIBUTION",
    "statement": "BIS's rule 2025-00636 states that it revises the Export Administration Regulations' controls on advanced computing integrated circuits and adds a new control on AI model weights for certain advanced closed-weight dual-use AI models; the Code of Federal Regulations states that the EAR are issued under laws relating to the control of certain exports, reexports and activities.",
    "evidence_status": "supported",
    "citations": [
      {
        "source_id": "src-062",
        "locator": "p.1, SUMMARY, first sentence",
        "anchor": "With this interim final rule, the Commerce Department’s Bureau of Industry and Security (BIS) revises the Export Administration Regulations’ (EAR) controls on advanced computing integrated circuits (ICs) and adds a new control on artificial intelligence (AI) model weights for certain advanced closed-weight dual-use AI models.",
        "standing": "originator",
        "read": {
          "accessed_at": "2026-10-15T07:13Z",
          "sha256": "0ec0f7fc1016b9654ea0559819e821d1baee1814efe1e0048a10d5df9230f86c"
        }
      },
      {
        "source_id": "src-057",
        "locator": "p.1, § 730.1 What these regulations cover, second sentence",
        "anchor": "The EAR are issued by the United States Department of Commerce, Bureau of Industry and Security (BIS) under laws relating to the control of certain exports, reexports, and activities.",
        "standing": "originator",
        "read": {
          "accessed_at": "2026-10-15T07:13Z",
          "sha256": "ae2ed36c9fed7314d42ba28b25b9018d342a68e14c6b47c14e03772d4ce1abc2"
        }
      }
    ],
    "as_of": "2025-01-15",
    "verified_on": "2026-10-15",
    "review": {
      "state": "not_reviewed"
    }
  },
  {
    "id": "claim-bis-rule-2025-00636-issued-in-us",
    "claim_type": "FACT",
    "statement": "The rule is issued by the Bureau of Industry and Security, Department of Commerce and amends the Export Administration Regulations, which the Code of Federal Regulations states are issued by the United States Department of Commerce, Bureau of Industry and Security.",
    "evidence_status": "supported",
    "citations": [
      {
        "source_id": "src-062",
        "locator": "p.1, AGENCY",
        "anchor": "AGENCY: Bureau of Industry and Security, Department of Commerce.",
        "standing": "originator",
        "read": {
          "accessed_at": "2026-10-15T07:13Z",
          "sha256": "0ec0f7fc1016b9654ea0559819e821d1baee1814efe1e0048a10d5df9230f86c"
        }
      },
      {
        "source_id": "src-057",
        "locator": "p.1, § 730.1 What these regulations cover, second sentence",
        "anchor": "The EAR are issued by the United States Department of Commerce, Bureau of Industry and Security (BIS) under laws relating to the control of certain exports, reexports, and activities.",
        "standing": "originator",
        "read": {
          "accessed_at": "2026-10-15T07:13Z",
          "sha256": "ae2ed36c9fed7314d42ba28b25b9018d342a68e14c6b47c14e03772d4ce1abc2"
        }
      }
    ],
    "as_of": "2025-01-15",
    "verified_on": "2026-10-15",
    "review": {
      "state": "not_reviewed"
    }
  },
  {
    "id": "claim-bis-rule-2025-00636-effective-2025-01-13",
    "claim_type": "FACT",
    "statement": "Rule 2025-00636 states that it is effective on 13 January 2025 (its text reads 'January 13. 2025').",
    "evidence_status": "supported",
    "citations": [
      {
        "source_id": "src-062",
        "locator": "p.1, DATES",
        "anchor": "Effective date: This rule is effective January 13. 2025.",
        "standing": "originator",
        "read": {
          "accessed_at": "2026-10-15T07:13Z",
          "sha256": "0ec0f7fc1016b9654ea0559819e821d1baee1814efe1e0048a10d5df9230f86c"
        }
      }
    ],
    "as_of": "2025-01-15",
    "verified_on": "2026-10-15",
    "review": {
      "state": "not_reviewed"
    }
  },
  {
    "id": "claim-bis-rule-2025-00636-revises-3a090",
    "claim_type": "ATTRIBUTION",
    "statement": "BIS's rule 2025-00636 states that supplement no. 1 to part 774 is amended by revising ECCNs that include 3A090; in its revised text, paragraph 3A090.c reads 'High bandwidth memory having a ‘memory bandwidth density’ greater than 2 gigabytes per second per square millimeter', and the note that follows is headed 'Technical note to 3A090.c'.",
    "evidence_status": "supported",
    "citations": [
      {
        "source_id": "src-062",
        "locator": "p.24, amendatory instruction 26",
        "anchor": "Supplement no. 1 to part 774 is amended by: ■ a. Revising ECCNs 3A001, 3A090, 3D001, 3E001, 4A003, 4A004, 4A005, 4A090, 4D001, 4D090, and 4E001;",
        "standing": "originator",
        "read": {
          "accessed_at": "2026-10-15T07:13Z",
          "sha256": "0ec0f7fc1016b9654ea0559819e821d1baee1814efe1e0048a10d5df9230f86c"
        }
      },
      {
        "source_id": "src-062",
        "locator": "p.31, ECCN 3A090, paragraph c",
        "anchor": "c. High bandwidth memory having a ‘memory bandwidth density’ greater than 2 gigabytes per second per square millimeter.",
        "standing": "originator",
        "read": {
          "accessed_at": "2026-10-15T07:13Z",
          "sha256": "0ec0f7fc1016b9654ea0559819e821d1baee1814efe1e0048a10d5df9230f86c"
        }
      },
      {
        "source_id": "src-062",
        "locator": "p.31, ECCN 3A090, the note after paragraph c",
        "anchor": "Technical note to 3A090.c: ‘Memory bandwidth density’ is the memory bandwidth measured in gigabytes per second",